{
  "$schema": "./schemas/edges.schema.json",
  "schema_version": "1.0.0",
  "status": "active",
  "edges": [
    {
      "from": "shell.cli",
      "to": "commands.registry",
      "kind": "load",
      "reason": "load command table"
    },
    {
      "from": "shell.cli",
      "to": "commands.builtins",
      "kind": "call",
      "reason": "dispatch by cmd id"
    },
    {
      "from": "shell.cli",
      "to": "commands.parsers",
      "kind": "call",
      "reason": "infer profile + parse args"
    },
    {
      "from": "shell.cli",
      "to": "services.command_log",
      "kind": "call",
      "reason": "append command_log entry"
    },
    {
      "from": "shell.cli",
      "to": "services.progress_event",
      "kind": "call",
      "reason": "append start/end progress events"
    },
    {
      "from": "shell.cli",
      "to": "shell.doctor",
      "kind": "call",
      "reason": "doctor subcommand"
    },
    {
      "from": "commands.registry",
      "to": "commands.builtins",
      "kind": "registry",
      "reason": "registry maps cmd_id -> builtin module"
    },
    {
      "from": "commands.builtins",
      "to": "transports.client",
      "kind": "call",
      "reason": "send request to service"
    },
    {
      "from": "commands.builtins",
      "to": "services.profile",
      "kind": "call",
      "reason": "read profile defaults (read-only)"
    },
    {
      "from": "commands.builtins",
      "to": "services.search",
      "kind": "call",
      "reason": "search builtin runs platform search via SearchEngine"
    },
    {
      "from": "transports.client",
      "to": "transports.ws",
      "kind": "call",
      "reason": "open ws to browser-service"
    },
    {
      "from": "transports.ws",
      "to": "services.browser_service",
      "kind": "call",
      "reason": "deliver message to handler"
    },
    {
      "from": "transports.http",
      "to": "services.browser_service",
      "kind": "call",
      "reason": "deliver http request to handler"
    },
    {
      "from": "transports.daemon",
      "to": "services.progress_event",
      "kind": "call",
      "reason": "fan out ws subscriptions"
    },
    {
      "from": "shell.daemon",
      "to": "services.progress_event",
      "kind": "call",
      "reason": "append daemon lifecycle and command events"
    },
    {
      "from": "shell.daemon",
      "to": "services.browser_service",
      "kind": "call",
      "reason": "orchestrate profile browser lifecycle"
    },
    {
      "from": "shell.daemon",
      "to": "services.daemon_registration",
      "kind": "call",
      "reason": "claim, publish, and release the shared daemon endpoint"
    },
    {
      "from": "shell.daemon",
      "to": "services.page_runtime",
      "kind": "call",
      "reason": "dispatch serialized browser commands to page operations"
    },
    {
      "from": "services.browser_service",
      "to": "contracts.ws_messages",
      "kind": "call",
      "reason": "parse/build envelope"
    },
    {
      "from": "services.browser_service",
      "to": "contracts.http_messages",
      "kind": "call",
      "reason": "parse/build envelope"
    },
    {
      "from": "services.browser_service",
      "to": "contracts.error_envelope",
      "kind": "call",
      "reason": "project errors"
    },
    {
      "from": "services.browser_service",
      "to": "services.session",
      "kind": "call",
      "reason": "create/read/delete session"
    },
    {
      "from": "services.browser_service",
      "to": "services.profile",
      "kind": "call",
      "reason": "resolve profile"
    },
    {
      "from": "services.browser_service",
      "to": "services.container",
      "kind": "call",
      "reason": "match container"
    },
    {
      "from": "services.browser_service",
      "to": "services.subscription",
      "kind": "call",
      "reason": "register / fire subscriptions"
    },
    {
      "from": "services.browser_service",
      "to": "services.page_runtime",
      "kind": "call",
      "reason": "inject + invoke page primitives"
    },
    {
      "from": "services.browser_service",
      "to": "services.lock",
      "kind": "call",
      "reason": "acquire/release profile lock"
    },
    {
      "from": "services.browser_service",
      "to": "services.display",
      "kind": "call",
      "reason": "read display metrics"
    },
    {
      "from": "services.session",
      "to": "services.profile",
      "kind": "call",
      "reason": "profile required input"
    },
    {
      "from": "services.session",
      "to": "services.lock",
      "kind": "call",
      "reason": "acquire on create, release on delete"
    },
    {
      "from": "services.session",
      "to": "services.page_runtime",
      "kind": "call",
      "reason": "tab/page operations"
    },
    {
      "from": "services.container",
      "to": "services.page_runtime",
      "kind": "call",
      "reason": "page context queries"
    },
    {
      "from": "services.subscription",
      "to": "services.container",
      "kind": "call",
      "reason": "match event source"
    },
    {
      "from": "services.page_runtime",
      "to": "runtime.page_scripts",
      "kind": "load",
      "reason": "load compiled bootstrap"
    },
    {
      "from": "services.autoscript",
      "to": "services.container",
      "kind": "call",
      "reason": "container subscription watcher"
    },
    {
      "from": "services.autoscript",
      "to": "services.page_runtime",
      "kind": "call",
      "reason": "execute operation"
    },
    {
      "from": "services.autoscript",
      "to": "services.progress_event",
      "kind": "call",
      "reason": "append run event"
    },
    {
      "from": "services.progress_event",
      "to": "transports.daemon",
      "kind": "call",
      "reason": "fan out ws subscribers"
    },
    {
      "from": "commands.builtins",
      "to": "commands.registry",
      "kind": "load",
      "reason": "read command schemas"
    },
    {
      "from": "commands.builtins",
      "to": "contracts.error_envelope",
      "kind": "call",
      "reason": "raise typed command errors"
    },
    {
      "from": "commands.builtins",
      "to": "services.daemon_registration",
      "kind": "call",
      "reason": "operate the shared daemon registration"
    },
    {
      "from": "commands.builtins",
      "to": "services.daemon_process",
      "kind": "call",
      "reason": "start the detached singleton daemon through its process owner"
    },
    {
      "from": "commands.parsers",
      "to": "commands.registry",
      "kind": "load",
      "reason": "parse registered command schemas"
    },
    {
      "from": "commands.parsers",
      "to": "contracts.error_envelope",
      "kind": "call",
      "reason": "raise typed parser errors"
    },
    {
      "from": "commands.registry",
      "to": "contracts.error_envelope",
      "kind": "call",
      "reason": "raise typed registry errors"
    },
    {
      "from": "commands.registry",
      "to": "protocol.versions",
      "kind": "load",
      "reason": "bind commands to protocol version"
    },
    {
      "from": "contracts.http_messages",
      "to": "contracts.error_envelope",
      "kind": "call",
      "reason": "project malformed HTTP envelopes"
    },
    {
      "from": "contracts.http_messages",
      "to": "protocol.versions",
      "kind": "load",
      "reason": "bind HTTP envelope version"
    },
    {
      "from": "contracts.ws_messages",
      "to": "contracts.error_envelope",
      "kind": "call",
      "reason": "project malformed WS envelopes"
    },
    {
      "from": "contracts.ws_messages",
      "to": "protocol.versions",
      "kind": "load",
      "reason": "bind WS envelope version"
    },
    {
      "from": "services.autoscript",
      "to": "contracts.error_envelope",
      "kind": "call",
      "reason": "raise typed autoscript errors"
    },
    {
      "from": "services.browser_service",
      "to": "services.browser_service.internal",
      "kind": "call",
      "reason": "delegate browser handles to internal owner"
    },
    {
      "from": "services.browser_service",
      "to": "services.progress_event",
      "kind": "call",
      "reason": "append browser lifecycle events"
    },
    {
      "from": "services.browser_service.internal",
      "to": "contracts.error_envelope",
      "kind": "call",
      "reason": "raise typed browser runtime errors"
    },
    {
      "from": "services.browser_service.internal",
      "to": "services.profile",
      "kind": "call",
      "reason": "resolve profile-owned storage paths"
    },
    {
      "from": "services.command_log",
      "to": "contracts.error_envelope",
      "kind": "call",
      "reason": "raise typed command-log errors"
    },
    {
      "from": "services.container",
      "to": "contracts.error_envelope",
      "kind": "call",
      "reason": "raise typed container errors"
    },
    {
      "from": "services.daemon_registration",
      "to": "contracts.error_envelope",
      "kind": "call",
      "reason": "raise typed registration errors"
    },
    {
      "from": "services.display",
      "to": "contracts.error_envelope",
      "kind": "call",
      "reason": "raise typed display errors"
    },
    {
      "from": "services.lock",
      "to": "contracts.error_envelope",
      "kind": "call",
      "reason": "raise typed lock errors"
    },
    {
      "from": "services.lock",
      "to": "services.daemon_registration",
      "kind": "call",
      "reason": "verify process-generation identity for profile lock ownership"
    },
    {
      "from": "services.lock",
      "to": "services.profile",
      "kind": "call",
      "reason": "resolve the profile-owned lock path"
    },
    {
      "from": "services.page_runtime",
      "to": "contracts.error_envelope",
      "kind": "call",
      "reason": "raise typed page-operation errors"
    },
    {
      "from": "services.page_runtime",